{"$schema":"https://json-schema.org/draft/2020-12/schema","$id":"https://mtl-archives.local/descriptor.schema.v1.json","type":"object","additionalProperties":false,"required":["schema_version","artifact_id","authoring","capture_receipts","manifest","predecessor","scope","production_mutation","created_at"],"properties":{"schema_version":{"const":"ground_authoritative_research_v1.5.0"},"artifact_id":{"const":"ground-authoritative-research-v1"},"authoring":{"$ref":"#/$defs/binding"},"capture_receipts":{"$ref":"#/$defs/binding"},"manifest":{"type":"object","additionalProperties":false,"required":["path","bytes","sha256"],"properties":{"path":{"const":"manifest-v1.json"},"bytes":{"type":"integer"},"sha256":{"type":"string","pattern":"^[a-f0-9]{64}$"}}},"predecessor":{"type":"object","additionalProperties":false,"required":["path","sha256"],"properties":{"path":{"const":"docs/dataset-factory/fixtures/ground-originals-v1/records-v1.json"},"sha256":{"type":"string","pattern":"^[a-f0-9]{64}$"}}},"scope":{"const":"evidence_capture_and_claim_drafting_only"},"production_mutation":{"const":false},"created_at":{"const":"2026-07-13T00:00:00.000Z"}},"$defs":{"binding":{"type":"object","additionalProperties":false,"required":["path","sha256"],"properties":{"path":{"type":"string"},"sha256":{"type":"string","pattern":"^[a-f0-9]{64}$"}}}}}
