{"artifact_id":"ground-authoritative-research-v1","authoring":{"path":"authoring-input-v1.json","sha256":"6dd6e628377be71bbc9a1ad867ad6444e43c974fa1ddb07f714a8cf292255419"},"capture_receipts":{"path":"capture-input-v1.json","sha256":"727c089733e05a9002a68001e18cae456c304009a07667fa01de57e1b6cabbac"},"created_at":"2026-07-13T00:00:00.000Z","manifest":{"bytes":1134,"path":"manifest-v1.json","sha256":"06c720f18e86b2ed9cd391e631efa05a09d9486d2633627f7d99046e6f6be8d1"},"predecessor":{"path":"docs/dataset-factory/fixtures/ground-originals-v1/records-v1.json","sha256":"55bca29de2bf7d5a41c031835db87a0b2d7f7627db360d63aaaab17a43806ad4"},"production_mutation":false,"schema_version":"ground_authoritative_research_v1.5.0","scope":"evidence_capture_and_claim_drafting_only"}
